{
  "document_type": "invoice",
  "fields": {
    "vendor_name": {
      "value": "Apex Infotech Solutions Pvt Ltd",
      "confidence": 0.98,
      "bbox": null
    },
    "invoice_number": {
      "value": "INV-2026-001",
      "confidence": 0.98,
      "bbox": null
    },
    "invoice_date": {
      "value": "2026-09-15",
      "confidence": 0.98,
      "bbox": null
    },
    "gstin": {
      "value": "27AABCA1234F1Z5",
      "confidence": 0.98,
      "bbox": null
    },
    "currency": {
      "value": "INR",
      "confidence": 0.98,
      "bbox": null
    },
    "subtotal": {
      "value": "10000.00",
      "confidence": 0.98,
      "bbox": null
    },
    "tax": {
      "value": "1800.00",
      "confidence": 0.98,
      "bbox": null
    },
    "total": {
      "value": "11800.00",
      "confidence": 0.98,
      "bbox": null
    }
  },
  "line_items": [
    {
      "description": "Cloud Hosting Subscription",
      "quantity": "1",
      "rate": "5000.00",
      "amount": "5000.00",
      "confidence": 0.98
    },
    {
      "description": "Technical Support Services",
      "quantity": "10",
      "rate": "350.00",
      "amount": "3500.00",
      "confidence": 0.98
    },
    {
      "description": "SSL Certificate 1-Yr",
      "quantity": "1",
      "rate": "1500.00",
      "amount": "1500.00",
      "confidence": 0.98
    }
  ],
  "raw_model_output": null
}